titulo,subtitulo,primer_parrafo,seccion
Jugadores que la ligan 2023,Peligro de Wolf,"El fútbol argentino regresó de la mano de la Liga Profesional y, como siempre, en Peligro de Wolf vamos a citar a sus protagonistas. Por empezar hay que decir que la AFA está más loca que una Cabral. ¿Cómo va a empezar el torneo un Díaz de enero? En esta época la gente se Marchi de vacaciones. De hecho, hace dos Domínguez yo Armani las valijas y me fui en mi moto Rojas a la Acosta, Más precisamente a Villa Gesell. Me esperaba Adela, una antigua amiga del Barrios, cuya familia tiene allí una Quintana. Paradela fue un Valdez de agua Frías, porque me esperaba la noche anterior. Llegué al Díaz siguiente, a las 8 de la Mammana porque en la ruta, a la altura de Varela, con mi moto Márquez Guerrero, debí Esquivel a un Gattoni y me Metilli en un Pozzo. Me di un Opazo fuerte, suerte que llevaba el Casco. ",Deportes
"El divertido festejo de Novak Djokovic al ritmo de ""Muchachos""",Tras consagrarse campeón en el Australian Open,"Novak Djokovic hizo historia. Otra vez. Venció en la final al griego Stefanos Tsitsipas, se consagró campeón del Australian Open y recuperó el puesto número 1 del mundo. Hasta ahí todo ""normal"". Lo inusual fue que tras los festejos, el serbio habló con un periodista argentino y se declaró fanático de Lionel Messi, de la Scaloneta y hasta se atrevió a cantar —de punta a punta— ""Muchachos"", el clásico hit de la Selección en el Mundial de Qatar 2022.",Deportes
Liga Profesional: Lanús derrotó 2 a 1 a Colón en Santa Fe,El conjunto granate se agrandó en el Cementerio de los elefantes,Lanús debutó en la Liga Profesional con un valioso triunfo por 2 a 1 en Santa Fe ante un Colón que llenó de preocupación a su público con una actuación deficiente en todo aspecto. La visita se puso en ventaja a los 12 minutos gracias a un tanto de Pedro De la Vega y sentenció el partido a los 26' del segundo tiempo en un contraataque que finalizó el ingresado Franco Orozco.,Deportes
Racing no pudo con el muro que le levantó Belgrano,Empate sin goles en el Cilindro de Avellaneda,"Un gustito a poco le quedó a Racing en su empate sin goles contra Belgrano. Buscó mucho pero encontró poco, pese a que utilizó diferentes vías para quebrar el muro defensivo de los cordobeses. Intentó con el desborde del siempre inquieto Johan Carbonero, con los pases en profundidad de Maxi Moralez o Juan Ignacio Nardoni, con las jugadas asociadas por el medio, con centros al corazón del aérea y con disparos de media distancia.",Deportes
"El Boca de Ibarra y un triunfo ""chiquito"" ante Atlético Tucumán",El Xeneize ganó en la Bombonera y debutó Sergio Romero en el arco,"La última vez que Boca y Atlético Tucumán se habían visto las caras, el primero todavía se estaba reacomodando de la salida de Battaglia e Ibarra encaraba su quinto partido como DT, mientras que el segundo era nada menos que el puntero de la Liga. El Xeneize se terminó imponiendo 2-1 con un doblete consagratorio de Langoni, dando origen a las denominadas notas SEO del estilo ""¿Quién es Luca Langoni, el nuevo héroe de Boca?"", y el equipo de Ibarra empezaba a construir el camino que lo tendría como campeón de la Liga, a puro resultado y con un funcionamiento poco convincente.",Deportes
"Novak Djokovic, la guerra y la eternidad: otra vez se consagró en Australia",Ganó por décima ocasión en Melbourne y alcanzó el récord de Grand Slams,"Novak Djokovic parece estar empecinado en enterrar la historia de un deporte centenario como el tenis. Invencible en las canchas del Melbourne Park, el serbio conquistó por décima ocasión el Abierto de Australia, una victoria que representa la 22ª en torneos de Grand Slam, el récord que registraba hasta el momento Rafael Nadal.",Deportes
Los partidos de hoy de la Liga Profesional 2023: Vélez vs Gimnasia,"Además, hora y TV de Barracas-Godoy Cruz y Banfield-Unión","La primera fecha de la Liga Profesional 2023 se cerrará este lunes con tres partidos. La cosa arrancará a las 17 con Barracas Central vs. Godoy Cruz de Mendoza, con transmisión de la TV Pública.",Deportes
Liga Profesional: Platense y Newell's empataron en Vicente López,"El equipo de Martín Palermo perdía de local, lo dio vuelta pero no pudo aguantar la ventaja","Platense y Newell´s igualaron este domingo por 2 a 2 en un encuentro repleto de goles y bloopers disputado en el estadio Ciudad de Vicente López, por la primera fecha del torneo de la Liga Profesional, en el debut del ""Gringo"" Gabriel Heinze como entrenador del elenco rosarino.",Deportes
Liga Profesional: Instituto y empataron en Córdoba,Fue un partido discreto que terminó sin goles,"Instituto de Córdoba, en su retorno a la máxima categoría, y Sarmiento de Junín empataron este domingo sin goles, en un discreto encuentro correspondiente a la fecha inaugural de la Liga Profesional de fútbol (LPF). ",Deportes
"El primer ""blooper"" de la Liga Profesional: Lucas Hoyos y un insólito cálculo con las manos",El arquero de Newell's fue responsable del gol de Platense,"La Liga Profesional de Fútbol hizo su estreno esta semana. Y al igual de goles, asistencia, también hubo lugar para los bloopers. El primero de este torneo fue, sin dudas, el de Lucas Hoyos, flamante arquero de Newell's en el empate de su equipo 2 a 2 con Platense, en Vicente López.",Deportes
Dinamarca gana el Mundial de Handball tras superar a Francia en la final  ,"El equipo danés, que logró su tercer título consecutivo, se impuso ante los galos por 34 a 29","El seleccionado de Dinamarca alcanzó este domingo el tercer título consecutivo, al quedarse con el Mundial de Handball Suecia Polonia 2023, luego de superar en la final a su par de Francia por 34-29.",Deportes
Rodrigo De Paul fue titular y la rompió en el Atlético de Madrid,Dio la asistencia del triunfo del equipo de Simeone,"El Atlético de Madrid de Diego Simeone venció este domingo por  1 a 0 al Osasuna con una formidable asistencia del volante Rodrigo De Paul, quien fue titular y terminó elegido como la figura del partido correspondiente a la fecha 19 de LaLiga de España.",Deportes
Los Leones golearon a Gales y finalizaron novenos en el Mundial,"El equipo argentino se despidió del torneo invicto, con tres triunfos y tres empates","El seleccionado argentino masculino de hockey sobre césped, Los Leones, superó este sábado a Gales por 6-0 y terminó en el noveno puesto de la Copa del Mundo que se desarrolla en la India. Los goles argentinos fueron convertidos por Lucas Toscani (a los 15 minutos), Martín Ferreiro (29 y 49), Agustín Bugallo (31), Santiago Tarazona (37) y Maico Casella (38).",Deportes
Liga de España: Barcelona se afianzó en la cima de la tabla,Un gol del Huevo Acuña para la victoria del Sevilla ante el Elche,"Barcelona le ganó este sábado como visitante a Girona por 1 a 0 en la decimonovena fecha y se aseguró la exclusividad de la punta de la Liga de España, sin atender el resultado de su escolta y vigente campeón, Real Madrid, que será local el domingo ante Real Sociedad.El duelo de equipos catalanes en el Estadio Municipal de Montilivi se resolvió a los 16 minutos del segundo tiempo con un gol del mediocampista del seleccionado español Pedri, de 20 años, quien celebró el centenar de partidos oficiales con la camiseta ""blaugrana"".  En el conjunto local fueron titulares los argentinos Paulo Gazzaniga en el arco y Valentín Castellanos en el ataque. Con su triunfo, Barcelona sumó 47 unidades, se despegó a seis de Real Madrid y volverá a jugar este miércoles, de visitante contra Betis, en un partido postergado.",Deportes
Liga de Italia: Inter ganó de la mano de Lautaro,El conjunto neroazzurro se impuso 2-1 a Cremonese con dos tantos del argentino,"El delantero del seleccionado argentino Lautaro Martínez, campeón mundial 2022, convirtió los dos goles con los que Inter derrotó 2-1 al colista Cremonese en un choque adelantado de la vigésima fecha de la Liga italiana. El bahiense, de 25 años, fue titular, anotó los goles a los 21m y 20m de cada etapa, alcanzó las once conquistas en el certamen, dos menos que el líder de la tabla de goleadores, el nigeriano Victor Osimhem, y logró su sexto tanto en siete partidos jugados este año.",Deportes
El equipo de la Davis viajó a Finlandia,"Con el capitán Coria fueron Fran Cerúndolo, Cachín, Bagnis, González y Molteni","El equipo argentino de Copa Davis, que capitanea Guillermo Coria, partió este sábado rumbo a Espoo, Finlandia, donde afrontará la serie de Qualifiers 2023 con el objetivo de volver a las Finales de la competencia por equipos más importante del mundo del tenis.El ""Mago"" Coria comentó, antes de subirse al avión, que el equipo fue con mucha ilusión. ""Vamos con las mejores expectativas, el equipo está muy bien, los chicos están contentos e ilusionados. Sabemos que nos vamos a enfrentar una serie muy dura, ellos tienen un single 1 muy duro (por Emil Ruusuvuori) y al número 11 del mundo en dobles (Harri Heliovaara), pero felices de sentir nuevamente la adrenalina de la Copa Davis"".Francisco Cerúndolo, Pedro Cachín, Facundo Bagnis y los doblistas Máximo González y Andrés Molteni integran el seleccionado que jugará el 4 y 5 de febrero en el Espoo Metro Arena ante Finlandia.Coria hizo un breve repaso de su equipo para la Asociación Argentina de Tenis. Sobre Cerúndolo, su primer singlista, el santafesino señaló: ""Fran viene de un gran Austalian Open, con mucha confianza. Arrastraba molestias que lo dejaron afuera del primer torneo y terminó la gira de forma espectacular. En las series de Bologna había estado a la altura, jugó dos partidazos"".""La de Pedrito Cachín es una convocatoria muy merecida, tuvo un gran 2022, donde pudo afirmar el gran nivel que venía teniendo desde hacía tiempo. Lo de Bagnis también es un premio al esfuerzo; es una gran persona, que suma mucho al grupo. Y el dobles tenemos a Molto y a Machi que tienen mucha experiencia. Molteni tuvo gran 2022 y González viene demostrando en Copa Davis que es una garantía"", completó Coria.Para el capitán, el objetivo ""es ganar y que los chicos puedan estar en un gran nivel. Sabemos que es difícil pero estamos preparados para afrontar la serie. A la gente le pido que nos apoye y tire buenas energías, que las vamos a necesitar"".",Deportes
Liga Profesional: Tigre sorprendió a Estudiantes gracias a Retegui,El equipo de Victoria se impuso 2-1 con dos tantos del goleador,"Tigre aprovechó la eficacia de su goleador Mateo Retegui para llevarse un festejado triunfo de La Plata. Con dos tantos del delantero, el conjunto de Diego Martínez se impuso 2-1 a Estudiantes, que no pudo celebrar en el debut oficial de Abel Balbo como entrenador. Mauro Boselli marcó el transitorio empate para el conjunto platense.",Deportes
"Liga Profesional: Independiente jugó, luchó y ganó en Córdoba",El conjunto de Avellaneda se impuso con un tanto de Martino en contra,"A la hora de jugar, Independiente siempre fue mejor. Y a la hora de luchar, tampoco resultó menos. En los dos planos que le ofreció el partido en Córdoba, el Rojo mostró respuestas positivas. Por eso, en el primer partido oficial de Leandro Stillitano como director técnico, estuvo bien su triunfo por 1 a 0 ante Talleres con un gol en contra de Angelo Martino en el segundo tiempo. Hubo dos expulsados en medio del trámite caliente: primero Marcone en Independiente y luego, Martino en la ""T"" cordobesa.",Deportes
Liga Profesional: River mostró sus credenciales y se impuso a Central Córdoba,El equipo de Demichelis ganó 2-0 con goles de Nacho Fernández y Solari,"River ganó en el debut oficial de Martín Demichelis y dejó muy buenas sensaciones de cara al futuro. El reestreno de Nacho Fernández, la vigencia de Casco y la claridad de Enzo Pérez fueron demasiados argumentos para justificar el triunfo 2-0 sobre un tímido Central Córdoba de Santiago del Estero.",Deportes
Sabalenka venció a Rybakina y se consagró campeona en Australia,Primer título de Grand Slam para la bielorrusa,"La bielorrusa Aryna Sabalenka consiguió este sábado su primer título de Grand Slam, al coronarse campeona del Abierto de Australia gracias a su victoria en la final sobre la kazaja Elena Rybakina por 4-6, 6-3 y 6-4. Este triunfo ante la vigente titular de Wimbledon, que demandó dos horas y 28 minutos en el Rod Laver Arena, le permitirá a la bielorrusa de 24 años ascender del quinto al segundo puesto del ranking WTA. ",Deportes
Liga Profesional: San Lorenzo empezó ganándole con lo justo a Arsenal,El equipo de Insua se impuso 1-0 con un gol de Vombergar,"Cuando el público de San Lorenzo empezaba a impacientarse, cuando de las tribunas acaloradas del Nuevo Gasómetro otra vez surgían los estribillos contra los dirigentes, un gol de Vombergar en el segundo tiempo obró el milagro y cambió el clima. Sin jugar bien y reiterando de a ratos las viejas carencias del año pasado, el equipo de Rubén Insúa derrotó 1 a 0 a Arsenal y arrancó el campeoanto con un triunfo esperado y necesario. ",Deportes
Cuidar el auto mejora la experiencia de manejo,Recomendaciones antes de emprender un viaje,"Conducir es una tarea compleja que generalmente se realiza instintivamente, sin reparar en muchos detalles, pero si se detiene a pensar en cómo tener una buena experiencia de manejo, se debe plantear que si antes de arrancar el auto, el vehículo está en condiciones para disfrutar de un viaje seguro y confortable. Este es un espacio que se habita con frecuencia, por ello requiere un mantenimiento constante.",Deportes
Dani Alves: 3 claves para entender el caso de violencia sexual del ex PSG,El futbolista se encuentra detenido en Barcelona,"Una joven de 23 años denunció al exjugador del Paris Saint-Germain Daniel Alves Silva, conocido como Dani Alves, por agresión sexual en una discoteca que el futbolista visitó la noche del 30 de diciembre. Alves fue detenido y permanece preso. Las tres claves para entender el caso. ",Deportes
Partidazo entre Huracán y Defensa y Justicia en el inicio de la Liga 2023,El Globo se impuso 4-2 en Florencio Varela,El Huracán de Diego Dabove tomó la cosa donde la dejó. El Globo venció este viernes por la noche por 4-2 a Defensa y Justicia en Florencio Varela y arrancó de gran manera el semestre que lo tendrá nuevamente en la Copa Libertadores.,Deportes
Abierto de Australia: Djokovic venció a Paul y jugará el domingo la final con Tsitsipas,El tenista serbio buscará agigantar su leyenda y el griego por el número 1,"El tenista serbio Novak Djokovic superó la polémica en la que se vio envuelto su padre y alcanzó su décima final del Abierto de Australia con una victoria por 7-5, 6-1 y 6-2 sobre el estadounidense Tommy Paul.",Deportes
Messi fue elegido el mejor futbolista de 2022 por el diario inglés The Guardian,"""Volvió del verano europeo escupiendo fuego"", afirmaron","El astro Lionel Messi, campeón con Argentina en el Mundial de Qatar, fue elegido como el mejor jugador de 2022 en el tradicional escalafón que elabora anualmente y oficializó este viernes el diario inglés The Guardian, por delante del francés Kylian Mbbapé. ",Deportes
La FIFA evalúa cambiar las reglas de los penales debido al estilo de Dibu Martínez,Los gestos y provocaciones del arquero de la Selección prendieron una luz de alarma,"La FIFA y la International Board, el ente que define las reglas del fútbol, analizan realizar modificaciones en el reglamento al momento de ejecutar un penal para limitar el accionar de los arqueros a partir del comportamiento que mostró Emiliano ""Dibu"" Martínez, arquero de la Selección argentina, en la Copa América 2021 y, sobre todo, en el Mundial de Qatar 2022.",Deportes
Acuerdo entre la Conmebol y la Concacaf para una Copa América integrada,El torneo se jugará en 2024 en Norteamérica,La Conmebol y la Concacaf anunciaron este viernes la firma de un acuerdo de  colaboración estratégico para fortalecer y desarrollar el fútbol en ambas regiones. El acuerdo incluye competiciones de selecciones nacionales femeninas y masculinas y un nuevo torneo de clubes.,Deportes
Liga Profesional: River visita a Central Córdoba en Santiago,"Este sábado, además, San Lorenzo recibe a Arsenal, Talleres a Independiente y Estudiantes a Tigre","La primera jornada de la Liga Profesional de Fútbol 2023 continuará este sábado con cuatro partidos. River buscará comenzar con el pie derecho la era de Martín Demichelis como entrenador del equipo cuando visite a Central Córdoba de Santiago del Estero, desde las 21.30 (TNT Sports), con arbitraje de Facundo Tello. Mientras que San Lorenzo abrirá la jornada frente a Arsenal, 17.00 en el Bajo Flores (ESPN Premium), con arbitraje de Diego Abal; Independiente visitará a las 19.15 a Talleres en el Mario Kempes, con arbitraje de Hernán Mastrángelo; y a la misma hora Estudiantes recibirá a Tigre en el estadio Uno de La Plata (TNT Sports) con arbitraje de Fernando Espinoza.",Deportes
Se largó la Liga Profesional 2023 con triunfo de Rosario Central,El equipo de Miguel Ángel Russo le ganó con lo justo a Argentinos,"Miguel Ángel Russo inició este viernes una nueva etapa en Rosario Central corroborando el célebre dicho ""técnico que debuta, gana"", que se ve también aplica para entrenadores de 66 años y con pasado en el club ya que este es nada menos que el quinto ciclo del DT en la Academia rosarina.",Deportes
La Argentina Sub 20 de Mascherano perdió con Colombia por un blooper y se quedó sin Mundial,La Selección cerró un Sudamericano de terror,"La Sub 20 de Javier Mascherano cerró su participación en el Sudamericano como la empezó: con derrota. Fue caída 1 a 0 ante la local Colombia este viernes por la noche en un mano a mano para pasar al Hexagonal Final y así, la Argentina, hexacampeona mundial de la categoría, no estará en el Mundial de Indonesia de mitad de año ni en los Panamericanos de noviembre.",Deportes
Argentina vs Colombia en el Sudamericano Sub-20: a qué hora juegan y cómo verlo en vivo,El equipo de Mascherano obligado a ganar para clasificar,"A la selección argentina sub-20 se le abrió una chance y no puede dejarla pasar. Gracias a su triunfo 1-0 ante Perú y el empate entre el anfritión Colombia y Brasil por 1-1 en la jornada del miércoles, el conjunto dirigido por Javier Mascherano depende de sí mismo para avanzar a la segunda ronda del Sudamericano y, con ello, mantener la ilusión de clasificarse para el Mundial de Indonesia. ",Deportes
"Miguel Angel Russo: ""Hay futbolistas que no quieren vivir en Rosario""",El DT de Central habló de las dificultades del club para incorporar refuerzos por el nivel de inseguridad de la ciudad,"El entrenador de Rosario Central, Miguel Ángel Russo, reveló que afrontó ""complicaciones"" en el mercado de pases durante las negociaciones para traer refuerzos, ya que ""hay futbolistas que no quieren vivir"" en esa ciudad santafesina por el alto nivel de inseguridad que se registra.",Deportes
Días de fiesta con uno de los mejores surfistas de tablas largas del mundo,El californiano Andy Nieblas dio cátedra en las olas de Mar del Plata,"Andy Nieblas es uno de esos tipos que parecen sacados de otra época: su pelo largo y bigote tupido le dan una imagen retro que se completa cuando uno lo ve en las olas, con un estilo muy particular, un logger de alma que navega con un arte que pueden disfrutar hasta los que nunca vieron surf. Una manera única, típica de aquellos que nacieron para este deporte. Flaquito, casi desgarbado, tampoco es el prototipo de surfista que tiene el imaginario popular, pero cuando va al agua, uno se da cuenta por qué es una figura mundial, rider de Quiksilver global. Por estos días su eximia calidad la demostró en nuestras rompientes, inspirando a quienes estuvieron cerca suyo y siendo la excusa para una verdadera fiesta surfera en Chapadmalal.",Deportes
Empieza la Liga Profesional y los técnicos vuelven a poner los dedos en el enchufe,Luego de tres meses largos de parate por el Mundial y el receso,Llegó el día y comienza este viernes el Campeonato de la Liga Profesional: el segundo de los seis torneos oficiales que AFA contempla para este año. Rosario Central-Argentinos Juniors desde las 19.15 en el Gigante de Arroyito y Defensa y Justicia-Huracán a partir de las 21.30 en Florencio Varela abrirán el juego de una primera fecha que se extenderá hasta el lunes.,Deportes
"Stillitano: ""El que quiera a Barreto y Costa, los va a tener que pagar""",,"El entrenador de Independiente, Leandro Stillitano, expresó su postura sobre las posibles salidas de los defensores Sergio Barreto y Ayrton Costa al asegurar que el club que quiera contratarlos ""tendrá que pagar"" lo que valen. ""Es muy simple, si alguien quiere a los jugadores de Independiente tiene que pagar lo que valen y hasta el momento eso no pasó"", afirmó el entrenador en conferencia de prensa.Barreto suena como refuerzo de Boca Juniors, mientras que Costa, quien volvió de su préstamo en Platense, recibió una oferta de Newell's. ""Las dos situaciones son entendibles pero los jugadores entran en algo feo porque los llaman y los confunden. Hoy están metidos en Independiente"", agregó el nuevo DT de Independiente que debutará oficialmente el sábado a las 19.15 contra Talleres, en Córdoba.Según lo que probó en las últimas prácticas, el equipo sería con Rey; Luciano Gómez, Barreto, Elizalde y Costa; Mulet e Iván Marcone; Tomás Pozzo, Juan Cazares, Rodrigo ""Chila"" Márquez; y Giménez.El defensor uruguayo Edgar Elizalde tenía que cumplir una fecha de suspensión por haber llegado a las cinco tarjetas amarillas, pero finalmente podrá ser de la partida tras la amnistia que decidió el miércoles el Comité Ejecutivo de la LPF. Martín Sarrafiore y el uruguayo Baltasar Barcia, los últimos en llegar, no formarán parte de la convocatoria para viajar a Córdoba.",Deportes
"Sabalenka-Rybakina, final inédita en el Abierto de Australia",La rusa y la kazaja definirán el título en el Melbourne Park,"El Abierto de Australia tendrá una campeona inédita. La rusa Aryna Sabalenka, número 5 del ranking de la WTA, y la kazaja Elena Rybakina, ubicada en el puesto 25 del escalafón, definirán el certamen y la ganadora se coronará por primera vez en el Melbourne Park.",Deportes
Los Leones se sacaron la bronca con una goleada,"En la lucha por el noveno puesto, vapulearon 8-0 a Chile","Los Leones se sacaron la bronca por la eliminación mundialista con una espectacular goleada sobre Chile por 8-0. Sin chances de luchar por el título tras la dolorosa caída por penales australianos ante Corea del Sur en los octavos de final, el seleccionado argentino de hockey sobre césped se quitó la mufa en un partido del grupo que determinará las posiciones del noveno al decimosexto puesto en la Copa del Mundo que se desarrolla en la India.",Deportes
"La violencia mata, la pobreza también",,"La duda es honda, viscosa. Hay tantas cosas que no se explican. Por qué es malo un subsidio para calmar el hambre y bueno para proteger el algodón estadounidense. Por qué son malos los países que cultivan coca, y bueno el modo de vida de los países que la consumen a toneladas. Por qué Macri nos regaló una deuda “buena”, cuando el mundo y el FMI sabían que era muy mala. Uno se pierde entre tanto “bien” y tanto “mal”. Por qué gran parte de la opinión publica exige prisión perpetua para los rugbiers acusados de asesinato, y parte de esa misma opinión pública no solo no condena el intento de asesinato a Cristina Kirchner, sino que lo pone en duda. Eternas neblinas del bien y del mal. En la modernidad, con la muerte retórica de Nietzsche sobre Dios, aceptamos que el mal se puede ejercer de plena voluntad. Hemos normalizado las exacerbaciones del mal porque las asumimos como parte de la especie humana. Ciertos aspectos de nuestras relaciones con el mal se han institucionalizado y normalizado. ",Deportes
Liga Profesional: Central y Argentinos abren la temporada 2023 en Rosario,"Este viernes, además, Defensa y Justicia recibirá a Huracán en Florencio Varela","Con el encuentro que jugarán este viernes Central y Argentinos en Rosario desde las 19.15; y el que animarán Defensa y Justicia ante Huracán, en Varela, a las 21.30, se iniciará la temporada 2023 de la Liga Profesional de Fútbol (LPF), con Boca Juniors como defensor del título, y la novedad de un tercer descenso a fin de año.",Deportes
"Juan Román Riquelme habló de Boca, los refuerzos y de la Copa Libertadores ","""Nos piden traer 14 jugadores, pero con lo que tenemos ganamos algo cada tres meses"", apuntó","El vicepresidente segundo de Boca Juniors, Juan Román Riquelme, dijo este jueves que con el plantel que tiene el club puede afrontar la nueva temporada. ""Escuchamos en la TV que tenemos que traer 14 refuerzos, pero nosotros estamos contentos con lo que tenemos, total ganamos algo importante cada tres meses"", manifestó el también responsable del Consejo de Fútbol boquense.",Deportes
Caso Dani Alves: habló la abogada de la víctima y complicó aún más al futbolista,Acusó al jugador de no usar presevativo,"La abogada de la joven de 23 años que denunció a Dani Alves por una agresión sexual en una discoteca de Barcelona, contó que el futbolista no usó preservativo en la presunta violación, por lo que la víctima tuvo que usar medicamentos antivirales para prevenir infecciones de transmisión sexual (ETS). Asimismo, aseguró que rechazaría una eventual propuesta de acuerdo para evitar una condena del futbolista.",Deportes
