titulo,subtitulo,primer_parrafo,seccion
Una charla de Pedro Saborido y Miguel Rep en Caras y Caretas,"La Legislatura porteña declarará ""personalidad destacada"" de la cultura al guionista y escritor","Este martes 24 de mayo, a las 20.30 horas, la Legislatura de la Ciudad declarará personalidad destacada de la cultura al guionista y escritor Pedro Saborido. El evento será en el Caras y Caretas de San Telmo (Venezuela 330) y contará con la participación del dibujante de Página/12 Miguel Rep. ",Cultura
Banksy llega a la Argentina con una exposición de 70 obras,Una muestra dedicada al artista se verá en agosto,"El grafitero inglés conocido como Banksy se convirtió en los últimos años en uno de los artistas más populares del mundo. Sus intervenciones en el espacio público y hechos como la subasta de 25 millones de una obra que se autodestruyó llamaron la atención. Ahora, tiene una muestra dedicada a su producción. Se trata de Bansky Genius or Vandal?, que llegará a la Argentina en agosto.",Cultura
"Vangelis, el músico griego que marcó una época del fútbol argentino",Entre sus muchos éxitos hay uno grabado en la memoria de los futboleros,"""Vangelis Papathanassiou ya no está con nosotros"". Con este escueto mensaje por Twitter se dio a conocer a conocer la noticia de la muerte de uno de los músicos más conocidos del mundo, autor de innumerables bandas sonoras. ",Cultura
La segunda temporada de El juego del calamar ya tiene fecha de estreno,Los adelantos de su creador ,"El creador de la popular serie El juego del calamar, Hwang Dong-hyuk, le puso fecha a la segunda temporada. Si bien advirtió que no tiene un guion definido, sino algunas pocas ideas, las negociaciones con Netflix ya está casi cerradas. Todo indica que para finales de 2023 la producción coreana tendrá su próximo lanzamiento. ",Cultura
El paraíso de las interespecies,De Arte no entiendo nada,"Caminar en soledad por la noche e imaginar cosas horribles causa un dolor sin cuerpo que puede ayudar a la creación de nuevas vidas y, por carácter transitivo, nuevas relaciones en el universo de las interespecies.",Cultura
La leyenda del linyera,,"Todos o casi todos los barrios siempre tuvieron su linyera y Villa Real, por supuesto, también tuvo el suyo. Era un hombre bastante grandote, con una barba muy tupida, pelo largo hasta la cintura, muy sucio, vestido de forma harapienta y al que lo habían bautizado “lechuguita”.",Cultura
Luca Prodan : el hippie que de rabia se volvió punk,El líder de Sumo hoy cumpliría 69 años ,"El viejo Parakultural de la calle Venezuela fue, para algunos, el lugar donde se gestaron muchos de los proyectos artístico culturales que mas tarde explotarían y saltarían al mainstream. Para mi fue una especie de trinchera contracultural, un hogar trash-hardcore que Omar Viola y Horacito Gabin habían abierto a fuerza de trabajo y pura fe en el underground. ",Cultura
Cuatro días de Mercado de Industrias Culturales ,En el Centro Cultural Néstor Kirchner habrá rondas de negocios y más de 150 actividades ,"El Ministerio de Cultura -a través de la Secretaría de Desarrollo Cultural - llevará a cabo una nueva edición del Mercado de Industrias Culturales Argentinas (MICA), que tendrá lugar del 19 al 22 de mayo en el Centro Cultural Kirchner, con entrada libre y gratuita. En su edición 2022, el MICA recibirá a más de 90 compradores y compradoras internacionales de 23 países; a más de 300 compradores y compradoras nacionales, y a miles de productoras y productores de bienes y servicios culturales de las provincias argentinas que participarán en las rondas de negocios y de las más de 150 propuestas de programación destinadas a profundizar conocimientos, intercambiar información y articular vínculos entre los/as protagonistas de todos los sectores.La programación completa de estas cuatro jornadas del incluye múltiples propuestas vinculadas con los 15 sectores que forman parte de este Mercado (audiovisual, artes visuales, circo, danza, diseño, editorial, folklore, gastronomía, hip hop, infancias, música, música académica, tango, teatro y videojuegos), programación artística y actividades producidas por el Programa MICA INCUBA, el Mercado Nacional de Artesanías Tradicionales e Innovadoras Argentinas (MATRIA) y por el Mercado de Cooperativismo y Culturas Autogestivas Argentinas (MARCA).",Cultura
Espejismo de una Drag en botines,Teatro,"El subsuelo del bar Brilla Cornelia -Juan Domingo Perón 1926- abre sus puertas este sábado a las 20.30 para presentar la obra de 40 minutos: Espejismo de una Drag en Botines, una original representación sobre textos de Alejandro Urdapilleta donde la “Drag Queen Tayda”, explora su historia de vida frente al espejo de su camarín antes de salir a escena.",Cultura
La nueva canción de Trueno que homenajea a Santiago Maldonado y las víctimas de la dictadura,"El rapero lanzó ""Bien o mal"", su nuevo disco","Trueno, el rapero argentino del momento, estrenó su segundo disco titulado ""Bien o mal"", en el que sacó a lucir su versión más contestataria con varias canciones que muestran su compromiso con la realidad y la historia argentina, con menciones los pueblos originarios, Santiago Maldonado, el gatillo fácil y la dictadura. ",Cultura
El termómetro de la nueva soberbia nerd,De Arte no entiendo nada,"Una de las mayores muestras de poder es dar órdenes en voz baja, pero en el mundo que viene rodando de 0 a 100 en milisegundos, esa pose de la soberbia encuentra incertidumbre y los poderosos se deben actualizar. Sube la temperatura, y la fiebre en el cambio de era es una infección de pantalla. Las supernovas iluminan y los agujeros negros pasan de ser orugas a mariposas led. Todo presente parece antiguo.",Cultura
"El emocionante relato de Fito Páez en un homenaje a Fabiana Cantilo: ""Me sacó de la cama en tardes interminables de dolor""",La cantante fue declarada Personalidad Destacada de la Cultura,"La cantante y referente del rock nacional fue distinguida como personalidad destacada de la cultura de la Ciudad este martes en la Legislatura porteña. Tras el acto, brindó un concierto en el que cantó canciones de tango y luego de rock. En el Salón Dorado, fue sorprendida por Fito Páez, quien brindó un emocionante discurso sobre su relación con Cantilo, a quien definió como la ""chica de oro"". ",Cultura
Presentarán el nuevo libro de Nunzia Locatelli y Cintia Suárez,"La obra se llama ""¿Qué han hecho?"" ","Juan Pablo I hoy vuelve a la escena mundial por un acontecimiento trascendental acaecido en Argentina: el Milagro argentino. La obra incluye testimonios exclusivos sobre un hecho prodigioso cuyos protagonistas son una niña de Paraná, un sacerdote porteño y Juan Pablo I.",Cultura
"Murió otro hijo de Nick Cave, el segundo en siete años","""Con mucha tristeza puedo confirmar que Jethro ha fallecido"", comunicó el artista","El músico australiano Nick Cave anunció este lunes la muerte de su hijo mayor, Jethro Lazenby, a los 30 años. La noticia llega siete años después de la pérdida de Arthur Cave, otro de los hijos del artista, que en julio de 2015 cayó desde un acantilado en la ciudad costera de Brighton, en Inglaterra.",Cultura
El fomento a la cultura no debe tener caducidad,,"En las últimas semanas, una gran cantidad de organizaciones sociales, de artistas y de trabajadores se están movilizando para garantizar que el fomento de numerosas actividades de la cultura y la comunicación no tenga fecha de caducidad, ya que desde hace décadas constituye una política de Estado en la Argentina.",Cultura
"Doctor Strange en el Multiverso de la Locura: la Buena, el Mago y la Bruja",El gran regreso de Sam Raimi al cine de superhéroes,"Desde julio de 1963, de la mano de Stan Lee y Steve Ditko, el neurocirujano Stephen Strange pasó de ser un médico egocéntrico y codicioso a ""el Maestro de las Artes Místicas"", el nexo entre los superhéroes -muchas veces más terrenales que los de su competencia- de Marvel y lo sobrenatural.",Cultura
La invasión metafísica de los 90,De arte no entiendo nada,"En estos tiempos vacíos se aleja y vuelve la “no realidad”, como una cinta elástica que anuncia el cierre de los 70 para renovar la fantasía que se mete por las fisuras del conurbano caliente.",Cultura
Hoy cumplo 96 años,Tributo a la esperanza,"96. Hoy cumplo 96 años y la cifra impacta pero no me inquieta porque decidí leerla en hebreo, de derecha a izquierda, una trampa que me retrotrae a mis 69 años, aunque imagino (o finjo) que tengo 50. ",Cultura
Los detalles de la serie que Robert De Niro  grabará en Argentina con Luis Brandoni,"""Nada"" se estrenará en 2023","El famoso actor estadounidense Robert De Niro llegó a la Argentina, donde permanecerá en los próximos días para participar del rodaje de una serie que protagonizará junto a Luis Brandoni, con quien mantiene una amistad desde hace décadas. La ficción se llamará “Nada”, y se estrenaría en 2023 a través de la plataforma de streaming Star +.",Cultura
"La autorreferencia, mi pecado favorito",,"El poder se ejerce preguntando puntualmente algo que uno ya sabe, en cambio la venta del poder inexistente es afirmar todo el tiempo lo que no es.",Cultura
La fascinante travesía de la Kon-Tiki: 101 días en balsa por el Pacífico para probar la llegada de americanos a la Polinesia,A 75 años del comienzo del histórico viaje de Thor Heyerdahl,"El 28 de abril de 1947, los peruanos que pasaron por el puerto limeño de El Callo presenciaron el comienzo de una de las experiencias más notables del siglo XX, un desafío aventurero sin precedentes. Seis hombres, a bordo de una balsa a vela bautizada como Kon-Tiki, iban a navegar rumbo a la Polinesia. Su objetivo: demostrar que los antiguos pobladores de América pudieron haber atravesado el Pacífico. Al frente del grupo se hallaba el noruego Thor Heyerdahl, que iba a convertirse en uno de los grandes exploradores del siglo.",Cultura
"El bombardeo de Guernica, la masacre que inmortalizó Picasso",Cómo fue el cruento ataque perpetrado hace 85 años en la Guerra Civil Española,"La Guerra Civil Española se acercaba a su primer año desde el alzamiento de 1936 cuando, el 26 de abril de 1937, se produjo uno de los hechos determinantes de la contienda, acaso el más célebre en los tres años de conflicto: el bombardeo de Guernica. La sola mención de la guerra que derivó en la dictadura de Francisco Franco tiene, como gran referencia, el ataque de la aviación alemana sobre esa ciudad vasca, y que, más allá de simpatías o antipatías por los republicanos, horrorizó al mundo. Fue el bautismo de fuego de la maquinaria bélica del nazismo.",Cultura
"Cervantes y Shakespeare, unidos por el 23 de abril","El mundo recuerda a los dos autores emblemáticos del castellano y el inglés, bajo la idea de que murieron el mismo día","El calendario señala que el 23 de abril es el Día Internacional del Libro por el aniversario de las muertes de los dos más grandes exponentes de la literatura en castellano y en inglés: Miguel de Cervantes y William Shakespeare. La Unesco instituyó la celebración, al tiempo que la ONU también toma la fecha como Día de la Lengua Española y Día de la Lengua Inglesa.",Cultura
La interna en el trabajo como épica de la esperanza,De arte no entiendo nada,"La semana pasada, después de terminar un libro aburridísimo, me di cuenta que la mala literatura tiene algo muy luminoso: Despertar la esperanza por descubrir buenos escritores. Cuando uno percibe la interna de un espacio, el tiempo deja plasmada una frase que lo sintetiza. Generalmente la interna es la violencia sutil que se ramifica en el pasillo de las promesas no cumplidas. El mejor ejemplo de la dicotomía en un mismo universo lo citó, si no me equivoco, Don Julio Cortázar en el ida y vuelta de sus publicaciones: “Cuando les hablo de publicar literatura, las editoriales me contestan con las necesidades del mercado y cuando les pregunto por el dinero, las editoriales me contestan con literatura”.",Cultura
Netflix perdió 200 mil suscripciones en el primer trimestre de 2022  ,Otros dos millones de usuarios podrían dar de baja sus cuentas en los próximos meses,"El gigante del streaming Netflix perdió alrededor de 200.000 suscriptores durante el primer trimestre de este año, y sus ejecutivos prevén que otros dos millones de usuarios podrían dar de baja sus cuentas entre abril y junio, por primera vez en una década.",Cultura
"Vargas Llosa, aislado en Madrid, tras haber dado positivo de coronavirus",El Nobel peruano tiene previsto asistir a la Feria del Libro de Buenos Aires ,"El escritor peruano Mario Vargas Llosa contrajo coronavirus y se halla aislado en su casa de Madrid. Según sus allegados, el estado de salud del Premio Nobel es bueno, pero deberá reprogramar sus actividades, que incluyen una visita a Buenos Aires en los primeros días de mayo, en el marco de la Feria del Libro.",Cultura
"Caballos, cerdos y conejos ",Amigos que juegan al Estanciero,"-¡¡¡Yo juego con el caballo!!! ¡El caballito es mío! - gritó Velarde ante sus amigos - ¿Por qué siempre vos con el caballo, viejo? – le retrucó Acuña. ",Cultura
"Historias, mitos y verdades del Titanic ",Se cumplen 110 años del naufragio en el Atlántico Norte,"La noche del 14 de abril de 1912, el Titanic golpeó un iceberg en su viaje inaugural, en el Atlántico Norte. En la madrugada del 15, el barco del que se decía que ni Dios podría hundirlo, se fue a pique. De algo más de 2200 personas que en total iban a bordo, unas 1500 perdieron la vida. Había zarpado de Southampton el 10 de abril, con destino a Nueva York. La tragedia dio pie a infinidad de relatos. El hundimiento más famoso de la historia se convirtió en una fuente casi inagotable de material.",Cultura
Una lágrima roja en Valentín Alsina,De arte no entiendo nada ,"En los años 60, vestido de cuero, se impuso el tango rojo de Sandro y el relámpago desconcertó a la paleta de colores del género canción.",Cultura
La Guerra entre el WI-FI y la Telepatía ,De arte no entiendo nada,"En esta tarde gris, como dice el gran Julio Sosa, llevo bajo el brazo el libro “La vida está en otra parte” de Milan Kundera. Instantes más tarde entro a un copetín al paso de Monte Grande y le pido al mozo la contraseña de la red inalámbrica para ahorrar datos. De pronto recibo una palmada en la espalda y apenas me doy vuelta me impacta la emoción de un encuentro soñado.",Cultura
Murió el escritor Sergio Chejfec,Tenía 65 años,"El escritor Sergio Chejfec murió este sábado a los 65 años en la ciudad de Nueva York, donde vivía y daba clases. La noticia fue confirmada por la Editorial Entropía, donde había publicado una de sus últimas obras, ""Teoría del ascensor"".",Cultura
"Murió Paul Herman, actor de ""Los Soprano""","Tenía 76 años y también se lo vio en películas como ""Buenos muchachos""","El actor Paul Herman, conocido por sus apariciones en películas como Buenos muchachos y en series como Los Soprano, falleció a los 76 años. Así lo informó su colega Michael Imperioli en Instagram.",Cultura
Baco pierde aceite en Camino Negro,De arte no entiendo nada,"En este tiempo si se le habla al corazón es mejor y puntualmente hacerlo en el broche del brindis le da el sentido a la mirada emocional. El Dios del vino lo sabe, por eso mismo es invitado a una fiesta clandestina en San Vicente para fomentar la conexión de la emoción sin pantalla. Siempre con actitud de un profesional, antes de emprender la aventura, se dispone a leer a Marechal y en la página 13 de “Adán Buenosayres” lo deja inmóvil un detalle. Es cuando duda, antes del preciso momento en el que pone “ir” en el mapa central del Waze y lo alerta el trazo rojo para un desvío imprevisto por Camino Negro.",Cultura
El mundo de la música despide a Taylor Hawkins,Repercusiones de la muerte del baterista de Foo Figthers,"Tras la inesperada noticia de su muerte a los 50 años, las redes sociales se colmaron de despedidas al baterista Taylor Hawkins. El músico, que integraba la banda Foo Fighters, falleció en la noche del viernes en Bogotá, días después de su presentación en la Argentina en el marco del Lollapalooza.",Cultura
La dictadura militar y la censura de la música popular argentina: del rock nacional al Nuevo Cancionero del foklore,Día de la memoria,"Este 24 de marzo se cumplen 46 años del último golpe cívico militar en Argentina. Ese mismo día la Junta Militar —comandada por Jorge Rafael Videla, Emilio Eduardo Massera y Orlando Ramón Agosti— derrocó a la presidenta María Estela Martínez de Perón. Se instauraba la dictadura más sangrienta de la historia argentina, caracterizada por la represión, el ataque contra los derechos humanos y la desaparición forzada de más de 30.000 personas.",Cultura
El desarrollismo en la visión divina,De arte no entiendo nada,"Mientras la vida es preocuparse por cosas que no pasan, el desarrollismo es vivir en la obra hecha y el proyecto soñado. Sucede que en la era de las emociones digitales todo queda igualado y hay que activar un recurso que siempre salva, la fe en lo imposible.",Cultura
Daddy Yankee en Argentina: todo lo que se sabe hasta ahora,La despedida del rey del reggaeton,"Ramón Luis Ayala Rodríguez, más conocido como Daddy Yankee, anunció su retiro de la música a través de un video compartido en su canal de YouTube. El puertorriqueño confirmó que realizará una gira despedida llamada ""La Última Vuelta"", en la que cantará en 14 países, entre los que se encuentra Argentina. ",Cultura
Subastarán la Marilyn de Andy Warhol y esperan recaudar 200 millones de dólares,Podría convertirse en la segunda obra de arte más cara de la historia,Uno de los cuadros emblemáticos del arte del siglo XX saldrá a la venta: el retrato que Andy Warhol hiciera de Marilyn Monroe.,Cultura
Hefesto en la fragua del conurbano caliente,De arte no entiendo nada ,"Escribir en modo onírico es una aparente incoherencia pero, como en el sueño, existen múltiples mensajes. Hoy el entendimiento pasa por estar más atento a las señales de la no realidad para evitar ser prisionero de la actual patología de la información.",Cultura
Murió el actor Arturo Bonín,Tenía 78 años ,El actor Arturo Bonín falleció este martes a los 78 años. Su familia confirmó el fallecimiento a través de un comunicado.,Cultura
El camisón de Gioconda en la batalla de San Lorenzo,De arte no entiendo nada,"En el paraje de la ruta me recomendaron dormir en la ciudad que emociona de la Argentina. Esa que te hace conocer varias historias propias e imaginarias, no solo la más importante en el campo de la gloria. Un muchacho callado que apodan Cogote saca a cuentagotas algunos secretos de la batalla.",Cultura
Las primeras imágenes de Joaquin Phoenix como Napoleón,Para la nueva película de Ridley Scott,"En las últimas horas se filtraron las primeras imágenes de Joaquin Phoenix como Napoleón Bonaparte, personaje al que interpretará en la película dirigida por Ridley Scott. Luego de 22 años, el director y el actor de Gladiador volverán a trabajar juntos. ",Cultura
Peaky Blinders 6: ¿cuándo se podrá ver en Netflix?,Se estrenó primero en BBC para el Reino Unido,"Peaky Blinders, una de las series más éxitosas de los últimos tiempos, llega a su fin. La sexta y última temporada de la vida de los mafiosos de Birmingham es de lo más esperado del año. ",Cultura
Qué pasó entre Residente y J Balvin y qué significan las referencias en su tema con Bizarrap,BZRP Music Sessions #49,"Este jueves por la noche se publicó en YouTube la Music Sessions 49 de Bizarrap, el joven productor argentino del género urbano que ha provocado una verdadera revolución. En esta oportunidad, el cantante es nada más y nada menos que Residente, el exlíder de Calle 13. ",Cultura
La fantasía de Atenea en la tríada presidenciable,De arte no entiendo nada,"En la magia del poder los cargos son menores. Esta verdad descoloca al pensador con sueldo fijo que, dudando con soberbia, compara un quirófano improvisado en un barrio marginal con la unidad entre mitología griega y la mística del armado político.",Cultura
"El horror de Colonia Dignidad, la secta de un abusador que apoyó a Pinochet","La historia del alemán Paul Schäfer, un nazi convertido en pastor","El 10 de marzo de 2005, un operativo de la Policía Federal Argentina derivó en el arresto de un anciano alemán en una estancia de Chivilcoy. Hacía varios días que llamaba la atención la presencia, en esa ciudad bonaerense, de dos hombres de mediana edad que hablaban con marcado acento alemán. Una investigación periodística constató se trataba de Peter Schmidt y Friedhelm Zeitner, quienes habían dejado Chile en 1997 junto a un anciano al que buscaba la justicia trasandina desde ese año. Los efectivos ingresaron a la estancia La Solita y hallaron a Paul Schäfer, de 84 años. Sobre él pesaba una orden de captura por abuso de menores. Y la sombra de haber participado de manera activa en el golpe militar de 1973 e integrado el aparato represivo de la dictadura. El nombre de Schäfer estaba vinculado a un lugar ubicado en los bellísimos bosques al otro lado de Mendoza, pero cuyo nombre es sinónimo de horror: Colonia Dignidad.",Cultura
Murió el artista plástico Antonio Seguí,Tenía 88 años,"El artista plástico Antonio Seguí falleció este sábado en Buenos Aires a los 88 años, tras no poder superar una operación de cadera. Había nacido en Córdoba en 1934 y se instaló en París en los años '60. Para noviembre de este año tenía prevista una muestra en el Centro de Arte Contemporáneo (CAC) de su ciudad natal.",Cultura
La Municipalidad de Ushuaia convoca a artistas al 3er Encuentro Internacional de Muralistas del Fin del Mundo ,Por el 40° Aniversario de la Gesta de Malvinas ,"La Municipalidad de Ushuaia a través de la Secretaría de Cultura y Educación convoca a artistas plásticos y muralistas de todo el país al 3er encuentro Internacional de Muralistas del Fin del Mundo “EMUSH 2022” que se llevará a cabo del 19 al 26 de marzo en la ciudad de Ushuaia, bajo la temática del “40° Aniversario de la Gesta de Malvinas”",Cultura
La constelación de Astroboy en Puente la Noria,De arte no entiendo nada,"En plena psicodelia, a fines de los años sesenta, un buen plan para la familia trabajadora, en su descanso del domingo, era ostentar las concurridas piletas de La Salada. El icónico anuncio de la cercanía lo indicaba el gran Puente la Noria que, anticipando el despertar del sur, cruza el Riachuelo siendo la envidia del Arco del Triunfo porque resplandece con él. Es la marca indeleble de la frontera tripartita, entre Capital Federal, zona oeste y el sur bonaerense. ",Cultura
"Roy Cohn, un fanático anticomunista que acompañó a Joseph McCarthy y fue abogado de Donald Trump",La historia del responsable de enviar a la silla eléctrica a un matrimonio por espionaje,"Si se mira material de archivo de las audiencias del cruzado anticomunista Joseph McCarthy durante la caza de brujas se aprecia que, junto al senador por Wisconsin, suele aparecer un joven de pelo negro, corto, y gesto adusto. ",Cultura
Duchamp con la papa en la boca en el Mercado Central,De arte no entiendo nada,"La sierra sin fin en la fábrica recuperada corta una crisis porque aquello que subestimamos en el presente puede ser un problema futuro. En el mismo sentido, se dice en el ámbito de la cosecha, que todo crece más fuerte cuando se lo talla. El riesgo de encontrar la solución simple a un campo complejo puede llevar la conflictividad al máximo. Por esa razón “etiquetar” es un verbo peligroso para poder resolver el enigma de la naturaleza.",Cultura
"La historia detrás del nacimiento de ""Frankenstein""",Una apuesta para escribir relatos de terror dio origen al célebre monstruo,"El relato del nacimiento literario de Frankenstein habla de una reunión de tres escritores en Suiza. La fecha: 16 de junio de 1816. Se sumó una cuarta persona y allí surgió una apuesta acerca de la creación de un relato terrorífico. No se suele mencionar que los reunidos eran cinco (la quinta persona fue, probablemente, el motivo del encuentro) y que además del moderno Prometeo (como lo subtituló Mary Shelley) también surgiría el primer relato vampírico. Se estila pensar también en un clima de tormenta, propicio para el encierro; una noche relampagueante más que ideal para que surgiera esa apuesta. Llovía en aquel verano de 1816 y no era ninguna casualidad.",Cultura
Sergio Galleguillo: “Es un orgullo ser riojano y llevar la Chaya por todo el país” ,Se presentó en el festival La Rioja Chaya 2022,"Minutos después de las 00 del lunes, el escenario mayor de La Rioja Chaya 2022 recibió al embajador cultural de los riojanos, y uno de los artistas más convocantes del cancionero popular argentino, Sergio Galleguillo, quien con su carisma y su repertorio, fue la ovación de la cuarta noche festivalera.",Cultura
