titulo,subtitulo,primer_parrafo,seccion
El día que The New Yorker rechazó un cuento de García Márquez,Un año antes de que recibiera el Premio Nobel,"""Creo que Carmen Balcells le ha informado que de mala gana hemos decidido no publicar su cuento 'El rastro de tu sangre en la nieve'"". De esta manera arranca la carta de Roger Angell, de la revista The New Yorker, a un escritor latinoamericano, fechada el 15 de julio de 1981. La prestigiosa revista literaria rechazó la publicación de un cuento de Gabriel García Márquez. Un año más tarde, el autor colombiano, cuya agente literaria es mencionada al comienzo de la misiva, recibiría el Premio Nobel de Literatura.",Cultura
"Murió Louise Fletcher, la enfermera villana de ""Atrapado sin salida"" ",Tenía 88 años y ganó el Oscar por ese papel ," Louise Fletcher, la actriz que interpretó a la enfermera tirana Mildred Ratched en Atrapado sin salida, falleció a los 88 años de edad, informó este viernes la familia. La actriz murió por causas que no han sido reveladas en su residencia de Montdurausse, en Francia, acompañada de su familia.Fletcher ganó en 1976 el Oscar a mejor actriz por ese papel, que también le valió reconocimiento internacional tras una carrera cinematográfica que hasta entonces había sido más bien discreta.",Cultura
El Indio Solari presentó tres canciones nuevas,Cada tema tiene un alter ego diferente del cantante ,"Bajo los alter egos El Mister, Los Marsupiales Extintos, y El Cantante Tímido, el Indio Solari estrenó tres nuevas canciones el viernes por la noche. Los temas fueron difundidos en el programa Big Bang, que conduce el periodista y escritor Marcelo Figueras, y luego quedaron disponibles desde la medianoche en la página oficial del artista.",Cultura
"Jaime Torres iluminado, la obra de Alejandro Marmo para homenajear al histórico folclorista ",Una iniciativa de Gisela Marziotta,"En el día en que el maestro Jaime Torres cumpliría 84 años se inauguró ""Jaime Torres Iluminado"", obra realizada por Alejandro Marmo y declarada de interés cultural por la Diputada Nacional Gisela Marziotta, quien junto a Elba Torres, esposa de Jaime, y sus hijos, descubrieron la obra.",Cultura
"Las confesiones de Joaquín Sabina en ""Sintiéndolo mucho"", el documental sobre su vida",Mitos y verdades de sus canciones y el debate por la vejez,"Miedos, influencias y algunas revelaciones íntimas. El fin de semana se estrenó en el festival de cine de San Sebastián “Sintiéndolo mucho”, un documental biográfico de Joaquín Sabina donde se retrata al icónico cantautor español “sin bombín, a muy pocos centímetros de su piel, con nocturnidad y alevosía”. Su visión de la juventud y su alerta por la vejez, en una vida repleta de excesos.",Cultura
Lo frágil de aquello imposible, De Arte no entiendo nada,"Uno suele pensar que lo impenetrable es imposible, y tal vez en esa hipótesis, se licuan otras variables para la conquista de una experiencia profunda.",Cultura
"El trailer de ""Argentina 1985"", la película  de Ricardo Darín sobre el histórico Juicio a las Juntas","Cuándo se estrena, dónde verla y el gran elenco","“Argentina 1985” genera grandes expectativas. El quinto largometraje de Santiago Mitre —basado en el Juicio a las Juntas, que juzgó a los nueve militares que lideraron la última dictadura militar de 1976— y que ya fue destacada para representar a Argentina en la la 37° edición de los Premios Goya, en España, y seleccionada para el Festival de Cine de Venecia, llegará a los cines el 29 de septiembre y, tres semanas más tarde, estará disponible en todo el mundo a través de la plataforma Amazon Prime Video.",Cultura
Julio Zamora acompañó a 250 alumnos y alumnas de secundarias locales que visitaron el Teatro Pepe Soriano,"El intendente de Tigre, en Benavídez","El intendente de Tigre, Julio Zamora, acompañó a 250 alumnos y alumnas de las EES N°5, 6 y 21 que visitaron el Teatro Pepe Soriano. Bajo el programa municipal ""Las Escuelas van al Teatro"", los estudiantes disfrutaron de la obra ""La casa de atrás"", una mirada documental de la historia de Ana Frank. La iniciativa permite que jóvenes de escuelas primarias y secundarias del distrito puedan aprovechar de forma gratuita la oferta del espacio cultural de Benavídez.",Cultura
"Murió Jorge Milchberg, el músico argentino artífice del éxito de ""El cóndor pasa""",Tenía 93 años y fue clave en el arreglo del clásico del repertorio latinoamericano,"El músico y compositor argentino Jorge Milchberg, célebre por los arreglos y la grabación de ""El cóndor pasa"", un himno del repertorio latinoamericano, murió en París a los 93 años. Así lo informó este viernes la Embajada de la Argentina en Francia.",Cultura
Llega la jornada ‘Fútbol Literatura’ a Morón,"Habrá charlas y reportajes con figuras del deporte, escritores y periodistas ","La jornada de “Fútbol y Literatura” llega a Morón el próximo sábado en el Microestadio Diego Armando Maradona del Polideportivo Gorki Grana — Predio Quinta Seré. Se trata de un evento cultural en donde se disfrutará de diferentes actividades relacionadas al deporte y las letras. Habrá charlas con referentes del mundo del deporte, entrevistas en vivo, stands de promoción y venta de libros, presentaciones de publicaciones, actividades recreativas y un patio gastronómico.",Cultura
El beso y el desconcierto en velocidad digital ,De Arte no entiendo nada,"Aquella frase que marcó a fuego un concepto de autoayuda, en libros de los años ’90, decía: “Culpar a los otros por fracasos propios, es frustración y envidia”. La edición con tapa amarilla estaba sobre el mostrador del stand de promociones de un banco que se fugó con capitales y cerró todas sus sucursales coloridas.",Cultura
Continúa la obra de recuperación de la casa natal de María Elena Walsh,En el Municipio de Morón,"El intendente Lucas Ghi junto al ministro de Cultura de la Nación, Tristán Bauer, recorrieron la construcción de lo que será el nuevo espacio cultural y comunitario en la residencia natal de María Elena Walsh, en la localidad de Villa Sarmiento.",Cultura
"Murió Wolfgang Petersen, el director de ""El barco"" y ""La historia sin fin""",El cineasta alemán tenía 81 años,"El cineasta alemán Wolfgang Petersen falleció a los 81 años. El deceso del realizador de La historia sin fin se produjo el viernes en Brentwood, California, pero se dio a conocer en las últimas horas. Sufría cáncer de páncreas y falleció acompañado de su esposa Marie Antoinette, con quien estuvo casado 50 años.",Cultura
Se inauguró la 5ta Feria del Libro en Merlo,Está abierta desde el 15 al 28 de agosto ,Desde el 15 al 28 de agosto se llevará adelante en el Parque Municipal Néstor Kirchner (Paseo El Tejadito) la 5ta Edición de la Feria del Libro de Merlo con la presencia de importantes editoriales argentinas. ,Cultura
La prensa iraní celebró el atentado contra Salman Rushdie,"""Felicitaciones a este hombre valiente y consciente del deber"", dice un diario ultraconservador, en alusión al atacante","El principal diario ultraconservador de Irán, Kayhan, celebró este sábado el ataque a  Rushdie y felicitó al hombre que apuñaló en Estados Unidos al novelista, a quien el ayatolá Komeini condenó a muerte en febrero de 1989 por considerar ""blasfema"" la novela Los versos satánicos.",Cultura
Marc Chagall y su prestigio eterno,De Arte no entiendo nada ,"Si la posta es lo etéreo, creer en la realidad es perderse en tiempo y espacio. De esta forma empezaría a pensar lo inspirador de la obra del pintor nacido en Bielorrusia.",Cultura
"Juan José Camero reveló que se está quedando ciego: ""La niebla ha cubierto mis ojos""",El emotivo relato del actor,"El reconocido actor Juan José Camero reveló en sus redes sociales que se está quedando ciego. La enfermedad comenzó hace dos años y en la actualidad, a los 78, describió que la niebla le cubrió los ojos. Según explicó el artista, padece una ceguera relativa que le deja solo un 10 por ciento de su visión. Pese a complicar muchas de sus actividades del día a día, contó que aún puede seguir caminando sin la asistencia de un bastón. ",Cultura
"Carlos Robledo Puch, el criminal de 20 años que estremeció a la Argentina",Cometió 11 asesinatos y cumple medio siglo preso,"El domingo 27 de febrero de 1972, los lectores de La Opinión se encontraron, en el suplemento cultural, con una crónica que no hablaba de libros, cine o música. Su autor hurgaba en una trayectoria de alguien que muy lejos estaba de ser de un artista, y que era noticia desde hacía tres semanas. Mejor dicho: era la única noticia de la que hablaba el país y La Opinión no había cubierto el caso. Osvaldo Soriano reseñó las andanzas criminales de Carlos Robledo Puch, de veinte años, detenido el 4 de febrero con un historial escalofriante de once asesinatos. Tal era la magnitud del caso que el diario de Jacobo Timerman decidió reseñar los pormenores en una crónica publicada en el suplemento de Cultura y que se volvería histórica. Si no se puede pensar el fusilamiento de Severino Di Giovanni sin el relato de Roberto Arlt, la historia del principal asesino múltiple de la historia criminal argentina iba a ser inseparable de El caso Robledo Puch.",Cultura
La nebulosa de arena y la conquista del espacio poético,De Arte no entiendo nada,"En la década fría de los ´90, de pronto “brotó ese yuyo verde”, como dice Homero Expósito en el tango. Y así, la conquista del género dejó de pedir permiso, en el decir de la rima con naftalina.",Cultura
"Vic Morrow, el actor que marcó una época con Combate y murió en la mayor tragedia de la historia de Hollywood",Fue decapitado por la hélice de un helicóptero ,"El accidente fatal que involucró a Alec Baldwin trajó a la memoria hechos similares con armas de fogueo en filmaciones de Hollywood, como las muertes de Jon-Erik Hexum y Brandon Lee, en 1984 y 1993; y, a nivel local, el accidente fatal de César Pierry. Sin embargo, antes de las muertes del actor de Viajeros y del hijo de Bruce Lee, hubo otra muerte trágica en un set de filmación, y que sacudió a la Meca del cine: la decapitación de Vic Morrow mientras se filmaba la película de La Dimensión Desconocida.",Cultura
Nirvana vuelve a escalar en las listas de reproducciones gracias a The Batman,Un nuevo fenómeno de revival gracias al cine y las series,"Luego de 31 años de su lanzamiento, ""Something in the Way"", de Nirvana, alcanzó el número 46 de Billboard HOT 100 chart. El motivo se debe a que la canción apareció en The Batman, protagonizada por Robert Pattinson y dirigida por Matt Reeves.",Cultura
"Hallaron muerta a una actriz de ""Elvis"" ",Shonka Dukureh tenía 44 años ,"La actriz Shonka Dukureh, que interpretó a Big Mama Thornton en la exitosa película biográfica Elvis, fue hallada sin vida en el dormitorio de su casa en Nashville, en el sureño estado de Tennessee. Tenía 44 años. ",Cultura
"La historia de Callejero Fino, el rapero que se reinventó en prisión y ahora lleva el RKT al Luna Park","""La música salva vidas""","El género musical RKT llegará al estadio Luna Park de la mano de Callejero Fino, uno de los referentes indiscutibles de ese circuito, que hasta ahora estaba en prisión domiciliaria y días atrás anunció un primer concierto tras haber cumplido una condena de seis años tras un delito cometido cuando era adolescente. ",Cultura
El Indio Solari publica cuatro canciones del show de Los Fundamentalistas en La Plata,Nuevo archivo ricotero,"Tal como viene haciendo en los últimos meses, el Indio Solari sorprendió con una nueva entrega de lo que dejó el show de Los Fundamentalistas del Aire Acondicionado en diciembre pasado. Pero la novedad, para la buena fortuna del público ricotero, no quedó ahí. El cantante contó en su cuenta de Twitter que, desde este lunes y hasta el jueves, la banda subirá a su cuenta de YouTube cuatro temas de su presentación en diciembre en el Estadio Único de La Plata.",Cultura
¿Steven Spielberg al frente de una película de Marvel?,"Se rumorea que podría dirigir ""Los 4 Fantásticos"" ","Marvel decidió apostar fuerte para la película de Los 4 Fantásticos y entabló relaciones con Steven Spielberg. El proyecto se quedó sin director con la salida de John Watts, el responsable de Spider-Man: No Way Home, y desde entonces se dispararon los rumores que ahora alcanzan al realizador de E. T. y Jurassic Park.",Cultura
"James Caan: de El Padrino a Misery, cuatro películas para ver en TV y streaming en Argentina ",Murió este jueves a los 82 años,"Este jueves se conoció la noticia de que el actor estadounidense James Caan murió a los 82 años. Recordado por papeles memorables como el de Santino ""Sonny"" Corleone en El Padrino y el del indefenso Paul Sheldon en Misery, el neoyorquino dejó una prolífica carrera dentro del cine.",Cultura
Murió el actor James Caan,Tenía 82 años,"El reconocido actor estadounidense James Caan, recordado por papeles memorables como Sonny Corleone en El Padrino y el indefenso Paul Sheldon en Misery, falleció este miércoles a la noche a los 82 años. La noticia fue confirmada este jueves por sus familiares a través de un mensaje en la cuenta oficial del actor en Twitter, en el que agradecieron las expresiones de cariño y solicitaron respetar la privacidad de sus allegados.",Cultura
Teorema de los favores y traiciones,De Arte no entiendo nada,"“Siento la alianza más perfecta”, dice Miguel Abuelo en el “Himno de mi corazón. Es ahí donde el abrazo puede tener muchas lecturas de favores y traiciones. Hay formas de ordenar los recuerdos de algunas uniones traumáticas, por ejemplo; dicen que la infancia se reconoce instantáneamente cuando uno escucha una canción que nos transporta a esa etapa. Así mismo la memoria es regente también del favor de un amigo para saber ser agradecido en momentos difíciles cuando la mano tendida nos ofrece luz en el alma. Ese tesoro de la buena amistad debe ser recíproco con quien nos ha ayudado.",Cultura
Spotify: cómo funciona la aplicación que arma playlist según tus artistas favoritos,Every Noise at Once crea mapas de géneros musicales ,"Si alguna vez te preguntaste cómo suena el discofox español de los años ‘70, o la salsa choke ecuatoriana de finales del siglo, o el hyperpop británico del ‘10, o post-hardcore japonés de la misma épica, seguro que la página Every Noise at Once será un campo de exploración sin precedentes. ",Cultura
La conquista de tu sonrisa ,De Arte no entiendo nada,"En los años en los que se impuso el slogan “sonría, lo estamos filmando”, también se estaba sembrando el “jajaja” vacío de la sonrisa virtual actual. La tecnología es una formula binaria, llena de ""ceros"" y ""unos"", opuesta a la lucha por los derechos igualitarios. Es la programación de vivir entre la contradicción del goce que nos conquista y la rabia por los desniveles que eso provoca. Si bien las realidades de la sonrisa asoman lentamente en las búsquedas de igualdad, los principios del siglo se ven colmados de capilaridad conceptual y lento resultado transformador. Entonces la impaciencia de lo diario se nos mete donde el final debe ser instantáneo.",Cultura
"La vida y el legado Jacques Cousteau, el señor de los mares",El oceanógrafo francés murió hace hoy 25 años,"Una de las marcas de la segunda mitad del siglo XX en cuanto a los avances de la ciencia fue la aparición de una figura: la del divulgador. Una persona con conocimientos sólidos en alguna materia podía entrar a los hogares de todo el mundo a través de los instrumentos de la industria cultural, como libros, películas y series de TV. Al menos tres hombres destacaron en distintas ramas: el estadounidense Carl Sagan explicó el Universo y sus confines desde la serie Cosmos, mientras que el español Félix Rodríguez de la Fuente maravilló con sus documentales sobre la vida animal. El mar y sus secretos fueron el tema de un francés: Jacques-Yves Cousteau.",Cultura
"Quién fue el ""Coronel"" Parker, el controvertido manager de Elvis Presley","Lo llevó al estrellato, pero también lo enfrentó con su peor versión","El 14 de julio próximo se estrenará en la Argentina Elvis, una nueva película biográfica sobre la figura del ""Rey del Rock & Roll"", pero esta vez centrada en la tumultuosa relación que la leyenda de la música mantuvo con su manager, el “Coronel"" Tom Parker, quien es interpretado en la pantalla por el multipremiado Tom Hanks.",Cultura
Brad Pitt dice que podría dejar la actuación este año,"La estrella de Hollywood se ve fuera, por decisión propia, ""en este semestre o trimestre""","Brad Pitt dio una entrevista en la que formuló un anuncio que sorprendió a todos: el actor dijo que está por dejar la actuación. Y podría ser en este mismo 2022, en ""este semestre o trimestre"".",Cultura
Carlos Gardel y el muñeco de madera que lo ligó con Astor Piazzolla,Lo llevaba consigo cuando murió hace 87 años en Medellín,"Un día, a mediados del siglo pasado, en Nueva York, el músico Andrés D´Aquila vio en un local a la calle que se vendía una pieza de madera por 20 dólares. Era un gaucho con una guitarra y se notaba que estaba chamuscado por el contacto con el fuego. Un cartelito indicaba: “Perteneció a un cantor argentino de tangos”. D´Aquila reconoció la firma tallada del autor, un apellido que conocía bien. Quiso comprar el muñeco, pero no tenía dinero suficiente y se comprometió a pasar al día siguiente. Sin embargo, el vendedor no se lo reservó y, cuando regresó, ya lo había vendido. El muñeco había sido tallado a pocas cuadras de ese local neoyorquino y había regresado de manera inexplicable a la Gran Manzana tras ser recuperado entre las pertenencias que llevaba Carlos Gardel al momento de su muerte. Más aún: D´Aquila era vecino del hombre que lo había tallado y fue el primer profesor de música de su hijo, quien le entregó el gaucho de madera al cantor.",Cultura
Las nuevas generaciones de músicos mantienen vivo el legado de Carlos Gardel,El concierto del ukelelista Julián Rodríguez y la presentación Las guitarras de Gardel,"Cada día canta mejor y a 87 años de su trágica muerte en un accidente aéreo en Medellín Carlos Gardel está más presente que nunca a partir de la difusión de su legado por parte de nuevas generaciones de músicos, que este viernes le rendirán distintos homenajes.",Cultura
"Horacio González, tan cercano como siempre","Homenaje en la Biblioteca Nacional, a un año de su muerte","Se cumplió un año de la muerte de Horacio González y sus amigos, su familia, sus discípulos, sus lectores, sus editores, quienes admiraron su obra pero también al hombre que fue, lo recordaron con una ""maratón"" en la Biblioteca Nacional, el lugar al que el sociólogo le imprimió su sello, en una gestión de puertas abiertas y abierta también al debate y la incorporación permanente de temas, que fue para él una suerte de segunda casa. Hubo música, palabras, libros, recuerdos, a lo largo de toda una tarde que culminó con asamblea, micrófono abierto en el que se volcaron todos los recuerdos y emociones, y choripaneada. ""Horacio fue un hombre de la conversada amistad, y queremos que este día sea contraeña para todas las conversaciones"", explicaron desde la biblioteca. ",Cultura
El veneno del optimismo,De Arte no entiendo nada,"El padecimiento de lo malo deja su aprendizaje para un verdadero trabajo de construcción espiritual. Es necesario afinar el concepto del optimismo cuando todo en la época viral es de una positividad fofa. Así lo dice la frase: Aprendí todo lo malo, aprendí todo lo bueno... en el tango ""Las cuarenta"".",Cultura
Traigan la cabeza de Paul McCartney,La verdadera historia del beatle falso ,"Uno de los rasgos distintivos a la hora de separar al hombre de la bestia -con la puntual excepción de ballenas y lemmings- acaso sea la feliz propensión del primero a la psicosis colectiva que puede llevarlo a danzar junto a las hogueras del nazismo como, por ejemplo, sostener conjuras mucho más modestas pero no por eso menos atendibles. Uno de los ejemplos más bizarros de semejante delirio -una historia digna de un capítulo doble de Los Expedientes X- fue la fiebre ""Paul está muerto"" a fines de los 60. La vigorosa leyenda urbana aseguraba que un tal William Campbell -sosías ""descubierto"" por el aparato beatle a partir de un concurso de dobles- había ocupado el sitio del bajista zurdo para asegurar la continuidad de la banda más exitosa de la historia de la música popular.",Cultura
"Fito Páez no para de agotar shows: por qué estalló la ""Páez-manía"" a 30 años de El amor después del amor",Ya vendió 60 mil tickets sólo para Buenos Aires,"La “Paezmanía” no se detiene. A 30 años del lanzamiento de El amor después del amor, el disco más vendido del rock nacional, Fito Páez agotó este miércoles su cuarto show en el estadio Movistar Arena. En poco más de media hora se agotaron los 15 mil tickets y los productores anunciaron la quinta fecha, con un final previsible: volver a agotar en cuestión de minutos.",Cultura
La piña que enseña,De Arte no entiendo nada,"En la calesita de la vida, ver la piña antes de recibirla puede llegar a ser la traducción de un símbolo que llama la atención en espacios de sociedades secretas. Las épocas pueden ser disimiles y asimétricas en lo que llamamos progresos y avances. Lo que no se modifica, en cambio, es el espíritu salvaje por sobrevivir y esquivar los accidentes geográficos de la inseguridad emocional que nacen naturalmente en la doble línea amarilla de la ruta de nuestra existencia.",Cultura
"Murió Paula Rego, la pintora que llevó el debate del aborto al arte",Tenía 87 años y fue la artista plástica más importante de Portugal,"La pintora portuguesa Paula Rego, la artista plástica más importante de ese país en el siglo XX, falleció este miércoles en Londres, donde residía. Una fuente de la familia confirmó el deceso de quien se hizo conocida por desafiar los cánones estéticos de corporalidad femenina y en especial por una impactante serie donde denunciaba el dolor y la humillación que aún sufren muchas mujeres al tener que recurrir al aborto clandestino.",Cultura
"Joaquín Sabina tendrá que pagar 2,5 millones de euros por derechos de autor no declarados",Irregularidades para pagar menos impuestos ,"Joaquín Sabina tendrá que pagar 2,5 millones de euros al ministerio de Hacienda español. Es por no haber declarado sus derechos de autor en los años 2008, 2009 y 2010. Así lo indicó este miércoles la justicia española, que había desestimado el recurso que impuso el cantante.",Cultura
La muerte verde de Plainpalais,De Arte no entiendo nada,"Las épocas van cambiando en relación al mercado de la muerte, y la humanidad sigue enganchada en la trampa de permanecer en la guerra perdida. Si bien está claro que nacemos para morir, nos resistimos al destino natural de este viaje donde todos somos pasajeros.",Cultura
La mirada que habla en la justicia,De Arte no entiendo nada,"Solo “La mirada” puede conectar a la comunidad, la justicia y la belleza. Una metáfora que resume resultados de participación que dejan huellas.",Cultura
"A 30 años de El amor después del amor, el disco de Fito Páez que revolucionó al rock y marcó a una generación",El perfume que lleva el dolor  ,El amor después del amor,Cultura
"A 28 años de la muerte de Juan Carlos Onetti, la historia de amor prohibido con Idea Vilariño","""Éramos dos monstruos""","Juan Carlos Onetti estaba enamorado de ella. Pero se lamentaba. Decía que ella no sentía lo mismo por él. Que no sentía que lo demostrara. “Con la cabeza lo entiendo, pero con el corazón no”, le decía. ",Cultura
Presentan un libro con relatos de enfermeros ,Un homenaje a la profesión impulsado por una compañía argentina de salud,"El próximo martes 31 de mayo a las 18:30 horas en el Teatro BRISA, ubicado en Thames 1426 de la Ciudad de Buenos Aires, con la presencia del Dr. Jorge Máximo Salvat, prestigioso neurocirujano argentino, se presentará el libro “Historias de Enfermeros Latinoamericanos” que reúne los relatos de enfermeros de diversos países del continente acompañado por ilustraciones de destacados artistas.",Cultura
El día que el hombre venció al Everest y llegó a la cúspide del mundo,Cómo fue que Edmund Hillary y Tenzing Norgay conquistaron el pico más alto del planeta,"El 29 de mayo de 1953, dos hombres llegaron a la cima del monte Everest. Habían escalado 8848 metros para arribar al pico más alto de la Tierra. Edmund Hillary y Tenzing Norgay hicieron cumbre en el Techo del Mundo, en lo que fue una de las grandes hazañas del siglo XX.",Cultura
Murió el bandoneonista Juan José Mosalini,Tenía 78 años y residía en Francia desde 1977,"El compositor y bandoneonista argentino Juan José Mosalini, de gran recorrido local como partícipe de las orquestas de José Basso, Horacio Salgán y Osvaldo Pugliese, falleció en las últimas horas a los 78 años en Francia, donde residía. Así lo informó la Academia Nacional de Tango.",Cultura
"""Hay Francisco para rato""",Encuentro entre el Papa y Marmo,"El artista argentino Alejandro Marmo fue recibido en el Vaticano por el papa Francisco. Le presentó una pieza de San Martín, su próxima obra que forma parte de la serie “Historia de la Argentina” y que está destinada a ser emplazada en breve en un espacio público de América Latina. El encuentro se produjo en la casa de Santa Marta, la residencia privada del Papa. ",Cultura
